Rank,Author,Title,Citations,Year,Publisher,Venue,Source,cit/year,DOI
32,"J Han, KK Ma",Fuzzy color histogram and its use in color image retrieval,480,2002, ieeexplore.ieee.org, IEEE Transactions on image Processing,https://ieeexplore.ieee.org/abstract/document/1025168/,20,10.1109/tip.2002.801585
71,P Schmid,Segmentation of digitized dermatoscopic images by two-dimensional color clustering,371,2002, ieeexplore.ieee.org, IEEE Transactions on Medical Imaging,https://ieeexplore.ieee.org/abstract/document/759124/,15,10.1109/42.759124
21,"T Lei, X Jia, Y Zhang, S Liu, H Meng…",Superpixel-based fast fuzzy C-means clustering for color image segmentation,354,2018, ieeexplore.ieee.org, … Transactions on Fuzzy …,https://ieeexplore.ieee.org/abstract/document/8584141/,44,10.1109/tfuzz.2018.2889018
5,ME Celebi,Improving the performance of k-means for color quantization,265,2011, Elsevier, Image and Vision Computing,https://www.sciencedirect.com/science/article/pii/S0262885610001411,18,10.1016/j.imavis.2010.10.002
2,"D Özdemir, L Akarun",A fuzzy algorithm for color quantization of images,178,2002, Elsevier, Pattern Recognition,https://www.sciencedirect.com/science/article/pii/S0031320301001704,7,10.1016/s0031-3203(01)00170-4
48,"Z Yu, OC Au, R Zou, W Yu, J Tian",An adaptive unsupervised approach toward pixel clustering and color image segmentation,167,2010, Elsevier, Pattern recognition,https://www.sciencedirect.com/science/article/pii/S0031320309004348,10,10.1016/j.patcog.2009.11.015
64,"WC Chen, MS Wang",A fuzzy c-means clustering-based fragile watermarking scheme for image authentication,166,2009, Elsevier, Expert Systems with Applications,https://www.sciencedirect.com/science/article/pii/S0957417407005751,10,10.1016/j.eswa.2007.11.018
15,"CH Chang, P Xu, R Xiao…",New adaptive color quantization method based on self-organizing maps,154,2005, ieeexplore.ieee.org, IEEE transactions on …,https://ieeexplore.ieee.org/abstract/document/1388472/,7,10.1109/tnn.2004.836543
23,"DW Kim, KH Lee, D Lee",A novel initialization scheme for the fuzzy c-means algorithm for color clustering,140,2004, Elsevier, Pattern recognition letters,https://www.sciencedirect.com/science/article/pii/S0167865503002228,6,10.1016/j.patrec.2003.10.004
61,"S Zeng, R Huang, H Wang, Z Kang",Image retrieval using spatiograms of colors quantized by gaussian mixture models,121,2016, Elsevier, Neurocomputing,https://www.sciencedirect.com/science/article/pii/S0925231215009820,12,10.1016/j.neucom.2015.07.008
66,"S Yin, Y Qian, M Gong",Unsupervised hierarchical image segmentation through fuzzy entropy maximization,106,2017, Elsevier, Pattern Recognition,https://www.sciencedirect.com/science/article/pii/S0031320317301115,12,10.1016/j.patcog.2017.03.012
6,"S Hsieh, KC Fan",An adaptive clustering algorithm for color quantization,91,2000, Elsevier, Pattern Recognition Letters,https://www.sciencedirect.com/science/article/pii/S0167865599001658,4,10.1016/s0167-8655(99)00165-8
82,"A Atsalakis, N Papamarkos",Color reduction and estimation of the number of dominant colors by using a self-growing and self-organized neural gas,87,2006, Elsevier, Engineering Applications of Artificial …,https://www.sciencedirect.com/science/article/pii/S0952197606000972,4,10.1016/j.engappai.2006.05.004
96,"JF Yang, SS Hao, PC Chung",Color image segmentation using fuzzy C-means and eigenspace projections,82,2002, Elsevier, Signal Processing,https://www.sciencedirect.com/science/article/pii/S0165168401001967,3,10.1016/s0165-1684(01)00196-7
36,"C Ozturk, E Hancer, D Karaboga",Color image quantization: a short review and an application with artificial bee colony algorithm,73,2014, content.iospress.com, Informatica,https://content.iospress.com/articles/informatica/inf25-3-08,6,10.15388/informatica.2014.25
68,"YC Hu, BH Su",Accelerated k-means clustering algorithm for colour image quantization,71,2008, Taylor & Francis, The Imaging Science Journal,https://www.tandfonline.com/doi/abs/10.1179/174313107X176298,4,10.1179/174313107x176298
26,"L Brun, A Trémeau",Color quantization,66,2017, taylorfrancis.com, Digital color imaging handbook,https://www.taylorfrancis.com/chapters/edit/10.1201/9781420041484-9/color-quantization-luc-brun-alain-tr%C3%A9meau,7,10.1201/9781420010749.ch86
100,"V Kalist, P Ganesan, BS Sathish, JMM Jenitha",Possiblistic-fuzzy C-means clustering approach for the segmentation of satellite images in HSL color space,64,2015, Elsevier, Procedia Computer …,https://www.sciencedirect.com/science/article/pii/S1877050915018931,6,10.1016/j.procs.2015.07.364
79,"D Mújica-Vargas, FJ Gallegos-Funes…",A fuzzy clustering algorithm with spatial robust estimation constraint for noisy color image segmentation,61,2013, Elsevier, Pattern Recognition …,https://www.sciencedirect.com/science/article/pii/S0167865512003340,5,10.1016/j.patrec.2012.10.004
90,"Y Sirisathitkul, S Auwatanamongkol…",Color image quantization using distances between adjacent colors along the color axis with highest color variance,59,2004, Elsevier, Pattern Recognition …,https://www.sciencedirect.com/science/article/pii/S0167865504000595,3,10.1016/j.patrec.2004.02.012
3,"Q Wen, ME Celebi",Hard versus fuzzy c-means clustering for color quantization,54,2011, Springer, EURASIP Journal on Advances in Signal Processing,https://link.springer.com/article/10.1186/1687-6180-2011-118,4,10.1186/1687-6180-2011-118
84,"N Gkalelis, A Tefas, I Pitas",Combining fuzzy vector quantization with linear discriminant analysis for continuous human movement recognition,48,2008, ieeexplore.ieee.org, … on Circuits and Systems for Video …,https://ieeexplore.ieee.org/abstract/document/4630765/,3,10.1109/tcsvt.2008.2005617
44,ME Celebi,An Effective Color Quantization Method Based on the Competitive Learning Paradigm.,48,2009, Citeseer, IPCV,https://citeseerx.ist.psu.edu/document?repid=rep1&type=pdf&doi=ca573d3377f7e843b8569e4396787549730af101,3,10.20965/jaciii.2010.p0375
30,"A Abernathy, ME Celebi",The incremental online k-means clustering algorithm and its application to color quantization,45,2022, Elsevier, Expert Systems with Applications,https://www.sciencedirect.com/science/article/pii/S0957417422011708,11,10.1016/j.eswa.2022.117927
76,"R Kaur, A Girdhar, S Gupta",Color image quantization based on bacteria foraging optimization,44,2011, researchgate.net, International Journal of Computer …,https://www.researchgate.net/profile/Surbhi-Gupta-26/publication/253461743_Color_Image_Quantization_based_on_Bacteria_Foraging_Optimization/links/57ed477908ae711da939956a/Color-Image-Quantization-based-on-Bacteria-Foraging-Optimization.pdf,3,10.5120/3042-4130
27,SA El-Said,Image quantization using improved artificial fish swarm algorithm,42,2015, Springer, Soft Computing,https://link.springer.com/article/10.1007/s00500-014-1436-0,4,10.1007/s00500-014-1436-0
42,"S Thompson, ME Celebi, KH Buck",Fast color quantization using MacQueen's k-means algorithm,42,2020, Springer,Time Image …,https://link.springer.com/article/10.1007/s11554-019-00914-6,7,10.1002/1520-684x(200007)31:8<33::aid-scj4>3.0.co;2-c
13,"ME Celebi, Q Wen, S Hwang",An effective real-time color quantization method based on divisive hierarchical clustering,40,2015, Springer,Time Image Processing,https://link.springer.com/article/10.1007/s11554-012-0291-4,4,10.1007/s11554-012-0291-4
37,"H Le Capitaine, C Frélicot",A fast fuzzy c-means algorithm for color image segmentation,40,2011, hal.science, EUSFLAT'2011,https://hal.science/hal-00738414/,3,10.5565/rev/elcvia.361
55,"J Chamorro-Martínez, JM Soto-Hidalgo…",Fuzzy color spaces: A conceptual approach to color vision,34,2016, ieeexplore.ieee.org, … on Fuzzy Systems,https://ieeexplore.ieee.org/abstract/document/7572922/,3,10.1109/tfuzz.2016.2612259
59,"J Chamorro-Martínez, D Sánchez…",A discussion on fuzzy cardinality and quantification. Some applications in image processing,33,2014, Elsevier, Fuzzy Sets and …,https://www.sciencedirect.com/science/article/pii/S0165011413002285,3,10.1016/j.fss.2013.05.009
46,ML Pérez-Delgado,The color quantization problem solved by swarm-based operations,33,2019, Springer, Applied Intelligence,https://link.springer.com/article/10.1007/s10489-018-1389-6,5,10.1007/s10489-018-1389-6
34,"L Feng, H Li, Y Gao, Y Zhang",A color image segmentation method based on region salient color and fuzzy c-means algorithm,31,2020, Springer, Circuits  Systems  and Signal Processing,https://link.springer.com/article/10.1007/s00034-019-01126-w,5,10.1007/s00034-019-01126-w
51,"P Bian, Y Jin, N Zhang",Fuzzy c-means clustering based digital camouflage pattern design and its evaluation,30,2010, ieeexplore.ieee.org, IEEE 10th International conference on …,https://ieeexplore.ieee.org/abstract/document/5655856/,2,10.1109/icosp.2010.5655856
14,"MM Islam, D Zhang, G Lu",Automatic categorization of image regions using dominant color based vector quantization,29,2008, ieeexplore.ieee.org, 2008 Digital Image Computing …,https://ieeexplore.ieee.org/abstract/document/4700020/,2,10.1109/dicta.2008.17
11,"D Tsolakis, GE Tsekouras, J Tsimikas",Fuzzy vector quantization for image compression based on competitive agglomeration and a novel codeword migration strategy,29,2012, Elsevier, Engineering applications of artificial …,https://www.sciencedirect.com/science/article/pii/S0952197611001679,2,10.1016/j.engappai.2011.09.014
53,"EJ Palomo, E Domínguez",Hierarchical color quantization based on self-organization,28,2014, Springer, Journal of mathematical imaging and vision,https://link.springer.com/article/10.1007/s10851-013-0433-8,2,10.1007/s10851-013-0433-8
69,"XD Yue, DQ Miao, LB Cao, Q Wu, YF Chen",An efficient color quantization based on generic roughness measure,28,2014, Elsevier, Pattern Recognition,https://www.sciencedirect.com/science/article/pii/S0031320313005037,2,10.1016/j.patcog.2013.11.017
93,"N Kim, N Kehtarnavaz",DWT-based scene-adaptive color quantization,26,2005, Elsevier,Time Imaging,https://www.sciencedirect.com/science/article/pii/S1077201405000446,1,10.1016/j.rti.2005.06.003
40,"D Yazdani, H Nabizadeh…",Color quantization using modified artificial fish swarm algorithm,26,2011, Springer, AI 2011: Advances in …,https://link.springer.com/chapter/10.1007/978-3-642-25832-9_39,2,10.1007/978-3-642-25832-9_39
1,"Z Liu, F Ding, Y Xu, X Han",Background dominant colors extraction method based on color image quick fuzzy c-means clustering algorithm,24,2021, Elsevier, Defence Technology,https://www.sciencedirect.com/science/article/pii/S2214914720304608,5,10.1016/j.dt.2020.10.002
39,"L Szilágyi, G Dénesi, SM Szilágyi",Fast color reduction using approximative c-means clustering models,23,2014, ieeexplore.ieee.org,IEEE …,https://ieeexplore.ieee.org/abstract/document/6891638/,2,10.1109/fuzz-ieee.2014.6891638
91,KK Bhoyar,Color Image Segmentation using Fast Fuzzy C-Means Algorithm,22,2010, elcvia.cvc.uab.es, ELCVIA Electronic Letters on Computer Vision and …,https://elcvia.cvc.uab.es/article/view/361,1,10.5565/rev/elcvia.361
16,"F Chung, BYM Fung",Fuzzy color quantization and its application to scene change detection,21,2003, dl.acm.org, Proceedings of the 5th ACM SIGMM international …,https://dl.acm.org/doi/abs/10.1145/973264.973290,1,10.1145/973264.973290
41,ML Pérez-Delgado,Color quantization with particle swarm optimization and artificial ants,20,2020, Springer, Soft Computing,https://link.springer.com/article/10.1007/s00500-019-04216-8,3,10.1007/s00500-019-04216-8
65,"WS Ooi, CP Lim",Fuzzy clustering of color and texture features for image segmentation: a study on satellite image retrieval,19,2006, content.iospress.com, Journal of Intelligent & Fuzzy Systems,https://content.iospress.com/articles/journal-of-intelligent-and-fuzzy-systems/ifs00299,1,10.4028/www.scientific.net/amm.441.707
7,"A Khaled, RF Abdel-Kader…",A hybrid color image quantization algorithm based on k-means and harmony search algorithms,19,2016, Taylor & Francis, Applied Artificial …,https://www.tandfonline.com/doi/abs/10.1080/08839514.2016.1169049,2,10.1080/08839514.2016.1169049
24,"L Szilágyi, G Dénesi, L Kovács…",Comparison of Various Improved-Partition Fuzzy c-Means Clustering Algorithms in Fast Color Reduction,19,2014, ieeexplore.ieee.org, 2014 IEEE 12th …,https://ieeexplore.ieee.org/abstract/document/6923585/,2,10.1109/sisy.2014.6923585
94,"X Yang, H Ren, B Li",Embedded zerotree wavelets coding based on adaptive fuzzy clustering for image compression,19,2008, Elsevier, Image and Vision Computing,https://www.sciencedirect.com/science/article/pii/S0262885607001540,1,10.1016/j.imavis.2007.08.019
50,"G Ramella, G SANNITI DI BAJA",A new technique for color quantization based on histogram analysis and clustering,19,2013, World Scientific, International Journal of Pattern …,https://www.worldscientific.com/doi/abs/10.1142/S0218001413600069,1,10.1142/s0218001413600069
62,"K Deshmukh, G Shinde",Adaptive Color Image Segmentation Using Fuzzy Min-Max Clustering.,18,2006, Citeseer, Engineering letters,https://citeseerx.ist.psu.edu/document?repid=rep1&type=pdf&doi=1f033ab8dbe95a3622c783878a7121b383ac17be,1,10.1109/ijcnn.2005.1556412
70,"K Kanjanawanishkul, B Uyyanonvara",Fast Adaptive Algorithm for Time-Critical Color Quantization Application.,18,2003, researchgate.net, DICTA,https://www.researchgate.net/profile/Bunyarit-Uyyanonvara/publication/221210076_Fast_Adaptive_Algorithm_for_Time-Critical_Color_Quantization_Application/links/09e4150ffa9285646d000000/Fast-Adaptive-Algorithm-for-Time-Critical-Color-Quantization-Application.pdf,1,10.1016/s0167-8655(99)00165-8
92,"S Makrogiannis, G Economou, S Fotopoulos",Region oriented compression of color images using fuzzy inference and fast merging,18,2002, Elsevier, Pattern Recognition,https://www.sciencedirect.com/science/article/pii/S0031320301001303,1,10.1016/s0031-3203(01)00130-3
81,"M Frackiewicz, H Palus",KM and KHM clustering techniques for colour image quantisation,17,2011, Springer, … vision and medical image processing: recent …,https://link.springer.com/chapter/10.1007/978-94-007-0011-6_9,1,10.1007/978-94-007-0011-6_9
25,"CY Lin, CH Chen",An invisible hybrid color image system using spread vector quantization neural networks with penalized FCM,17,2007, Elsevier, Pattern Recognition,https://www.sciencedirect.com/science/article/pii/S0031320306004778,1,10.1016/j.patcog.2006.11.004
74,"L Zhao, Z Wang, Y Zuo, D Hu",Comprehensive evaluation method of ethnic costume color based on K-means clustering method,17,2021, mdpi.com, Symmetry,https://www.mdpi.com/2073-8994/13/10/1822,3,10.3390/sym13101822
56,"SG Kandi, MA Tehran, M Rahmati",New method for obtaining proper initial clusters to perform FCM algorithm for colour image clustering,16,2009, Taylor & Francis, The Journal of The Textile …,https://www.tandfonline.com/doi/abs/10.1080/00405000701757545,1,10.1080/00405000701757545
98,"SS Park, KK Seo, DS Jang",Fuzzy art-based image clustering method for content-based image retrieval,15,2007, World Scientific, International Journal of Information …,https://www.worldscientific.com/doi/abs/10.1142/S0219622007002496,1,10.1142/s0219622007002496
83,"M Lei, Y Zhou, Q Luo",Color image quantization using flower pollination algorithm,15,2020, Springer, Multimedia Tools and Applications,https://link.springer.com/article/10.1007/s11042-020-09680-1,2,10.1007/s11042-020-09680-1
8,"M Frackiewicz, A Mandrella, H Palus",Fast color quantization by K-means clustering combined with image sampling,14,2019, mdpi.com, Symmetry,https://www.mdpi.com/2073-8994/11/8/963,2,10.3390/sym11080963
19,"ME Celebi, Q Wen, S Hwang, G Schaefer",Color quantization of dermoscopy images using the k-means clustering algorithm,14,2013, Springer, Color Medical Image Analysis,https://link.springer.com/chapter/10.1007/978-94-007-5389-1_5,1,10.1007/978-94-007-5389-1_5
12,"P Jitpakdee, P Aimmanee…",A hybrid approach for color image quantization using k-means and firefly algorithms,13,2013, academia.edu, World Acad. Sci. Eng …,https://www.academia.edu/download/82739784/6965.pdf,1,10.1002/9781119551621.ch9
18,"S Kiranyaz, S Uhlmann…",Dominant color extraction based on dynamic clustering by multi-dimensional particle swarm optimization,13,2009, ieeexplore.ieee.org, 2009 Seventh International …,https://ieeexplore.ieee.org/abstract/document/5137838/,1,10.1109/cbmi.2009.11
57,"ML Perez-Delgado, JÁR Gallego",A hybrid color quantization algorithm that combines the greedy orthogonal bi-partitioning method with artificial ants,13,2019, ieeexplore.ieee.org, IEEE Access,https://ieeexplore.ieee.org/abstract/document/8815696/,2,10.1109/access.2019.2937934
60,"S Kiranyaz, S Uhlmann, T Ince, M Gabbouj",Perceptual dominant color extraction by multidimensional Particle Swarm Optimization,12,2010, Springer, EURASIP Journal on …,https://link.springer.com/content/pdf/10.1155/2009/451638.pdf,1,10.1155/2009/451638
10,"L Dong, W Dong, N Feng, M Mao, L Chen…",Color space quantization-based clustering for image retrieval,12,2017, Springer, Frontiers of Computer …,https://link.springer.com/article/10.1007/s11704-016-5538-y,1,10.1007/s11704-016-5538-y
58,G Schaefer,Soft computing-based colour quantisation,12,2014, Springer, EURASIP Journal on Image and Video Processing,https://link.springer.com/article/10.1186/1687-5281-2014-8,1,10.1186/1687-5281-2014-8
97,"KNS Bel, IS Sam",Black hole Entropic Fuzzy Clustering-based image indexing and Tversky index-feature matching for image retrieval in cloud computing environment,12,2021, Elsevier, Information Sciences,https://www.sciencedirect.com/science/article/pii/S0020025521000815,2,10.1016/j.ins.2021.01.043
88,"SO Abter, NAZ Abdullah",An efficient color quantization using color histogram,11,2017, ieeexplore.ieee.org, … Annual Conference on New Trends in …,https://ieeexplore.ieee.org/abstract/document/7976153/,1,10.1109/ntict.2017.7976153
52,"CH Chang, M Shibu, R Xiao",Self organizing feature map for color quantization on FPGA,11,2006, Springer, FPGA implementations of neural networks,https://link.springer.com/chapter/10.1007/0-387-28487-7_8,1,10.1007/0-387-28487-7_8
9,"GE Tsekouras, DM Tsolakis",Fuzzy clustering-based vector quantization for image compression,11,2012, Springer, Computational Intelligence in Image …,https://link.springer.com/chapter/10.1007/978-3-642-30621-1_5,1,10.1007/978-3-642-30621-1_5
75,"K Nongmeikapam, WK Kumar…",An unsupervised cluster-wise color segmentation of medical and camera images using genetically improved fuzzy-Markovian decision relational model,11,2018, content.iospress.com, … Intelligent & Fuzzy …,https://content.iospress.com/articles/journal-of-intelligent-and-fuzzy-systems/ifs17968,1,10.3233/jifs-17968
43,"J Zhang, Y Song, Y Zhang…",A new approach of color image quantization based on Normalized Cut algorithm,10,2011, ieeexplore.ieee.org, The First Asian …,https://ieeexplore.ieee.org/abstract/document/6166589/,1,10.1109/acpr.2011.6166589
85,"B Kaur, P Kaur",Improving the color image segmentation using fuzzy-C-means,8,2016, ieeexplore.ieee.org, 2016 International Conference on Advanced …,https://ieeexplore.ieee.org/abstract/document/7831747/,1,10.1109/icaccct.2016.7831747
99,"R Kaur, S Gupta, PS Sandhu",Optimization color quantization in L* A* B* color space using particle swarm optimization,8,2011, academia.edu, Proceedings of International …,https://www.academia.edu/download/81021499/68._20ravneet_paper.pdf,1,10.1109/inventive.2016.7823295
29,T Rahkar Farshi,Color image quantization with peak-picking and color space,8,2020, Springer, Multimedia Systems,https://link.springer.com/article/10.1007/s00530-020-00682-5,1,10.1007/s00530-020-00682-5
45,"X Zhu, J Zhao, J Yuan, H Xu",A fuzzy quantization approach to image retrieval based on color and texture,7,2009, dl.acm.org, … of the 3rd International Conference on …,https://dl.acm.org/doi/abs/10.1145/1516241.1516265,0,10.1145/1516241.1516265
72,AS Capelle-Laizé…,TBM for color image processing: a quantization algorithm,7,2006, ieeexplore.ieee.org, 2006 9th International …,https://ieeexplore.ieee.org/abstract/document/4086105/,0,10.1109/icif.2006.301819
54,"R Sombutkaew, Y Kumsang…",Adaptive quantization with Fuzzy C-mean clustering for liver ultrasound compression,6,2014, ieeexplore.ieee.org, 2014 14th International …,https://ieeexplore.ieee.org/abstract/document/6987834/,0,10.1109/iccas.2014.6987834
47,M Roberto e Souza…,A Hybrid Approach Using the ‐means and Genetic Algorithms for Image Color Quantization,6,2020, Wiley Online Library, … for Data Clustering,https://onlinelibrary.wiley.com/doi/abs/10.1002/9781119551621.ch9,1,10.1002/9781119551621.ch9
33,"ML Pérez-Delgado, MA Günen",A comparative study of evolutionary computation and swarm-based methods applied to color quantization,6,2023, Elsevier, Expert Systems with Applications,https://www.sciencedirect.com/science/article/pii/S0957417423011685,2,10.1016/j.eswa.2023.120666
17,"FZB Belahbib, F Souami",Genetic algorithm clustering for color image quantization,5,2011, ieeexplore.ieee.org, 3rd European Workshop on Visual …,https://ieeexplore.ieee.org/abstract/document/6045508/,0,10.5923/j.ajsp.20120204.04
38,"M Saeed, H Nezamabadi-Pour",Fuzzy color quantization and its application in Content-based image retrieval,5,2008, academia.edu, Proc. of the WSEAS Int. Conf. on …,https://www.academia.edu/download/96459321/9-CISST.pdf,0,10.24297/ijct.v13i10.2332
86,"H Naz, T Saba, FS Alamri, AS Almasoud…",An improved robust fuzzy local information k-means clustering algorithm for diabetic retinopathy detection,5,2024, ieeexplore.ieee.org, IEEE Access,https://ieeexplore.ieee.org/abstract/document/10506509/,2,10.1109/access.2024.3392032
78,"ME Celebi, Q Wen",VARIANCE-CUT: A fast color quantization method based on hierarchical clustering,4,2013, ieeexplore.ieee.org, 2013 International Conference on …,https://ieeexplore.ieee.org/abstract/document/6718239/,0,10.1109/icecco.2013.6718239
63,"R Sombutkaew, O Chitsobhuk, D Prapruttam…",Adaptive quantization via fuzzy classified priority mapping for liver ultrasound compression,4,2016, ijicic.org, Int. J. Innov. Comput. Inf …,http://ijicic.org/ijicic-120223.pdf,0,10.1109/iccas.2014.6987834
89,"ML Pérez-Delgado, ME Celebi",A comparative study of color quantization methods using various image quality assessment indices,4,2024, Springer, Multimedia Systems,https://link.springer.com/article/10.1007/s00530-023-01206-7,2,10.1007/s00530-023-01206-7
49,"CH Chou, MC Su, YX Zhao, FH Hsu",A reinforcement-learning approach to color quantization,4,2011, jase.tku.edu.tw, Journal of Applied Science …,http://jase.tku.edu.tw/articles/jase-201106-14-2-07,0,10.3182/20020721-6-es-1901.01068
28,"SJ Wang, YS Wu",Could not catch title,4,0," Journal of CCI T, 2008",SJ Wang,"Look manually at: https://scholar.google.com/scholar?start=20&q=Dominant+color+quantization+using+fuzzy+clustering&hl=en&as_sdt=0,5&as_ylo=2000",0,10.7748/ns.16.31.23.s39
73,"E Pelayo, D Buldain, C Orrite",Focused image color quantization using magnitude sensitive competitive learning algorithm,4,2012, scitepress.org, International Conference on Neural …,https://www.scitepress.org/Papers/2012/41508/,0,10.5220/0004150805160521
80,"M Frąckiewicz, H Palus, R Tadeusiewicz…",Initialization methods for clustering in colour quantization techniques,4,2009, academia.edu, … Methods and Systems …,https://www.academia.edu/download/50832141/Initialization_methods_for_clustering_in20161211-15258-qv0gfv.pdf,0,10.1007/978-3-642-24728-6_7
22,"DL Yang, JW Zhang",Study of image quantization technology based on FCM clustering algorithm,3,2010, ieeexplore.ieee.org, 2010 International Conference on …,https://ieeexplore.ieee.org/abstract/document/5743452/,0,10.1109/isdea.2010.55
4,"L Szilágyi, G Dénesi, C Enăchescu",Fast color quantization via fuzzy clustering,3,2016, Springer, … 2016  Kyoto  Japan  October 16–21 …,https://link.springer.com/chapter/10.1007/978-3-319-46681-1_12,0,10.1007/978-3-319-46681-1_12
77,"KM Goh, Z Ismaail",8 Colour Quantization of Colour Construct Code in CIELAB Colour Space Using K-Means Clustering and Hungarian Assignment,2,2016, Springer, Advanced Computer and Communication Engineering …,https://link.springer.com/chapter/10.1007/978-3-319-24584-3_57,0,10.1007/978-3-319-24584-3_57
31,"M Kılıçaslan, MO İncetaş",Adaptive Color Quantization Method with Multi-level Thresholding,2,2023, Springer, International Journal of Computational …,https://link.springer.com/article/10.1007/s44196-023-00185-x,1,10.1007/s44196-023-00185-x
95,SK Bandyopadhyay,Colour quantization Technique for medical image segmentation,1,2011, search.proquest.com, … Journal of Research and Reviews in …,https://search.proquest.com/openview/e6dd73407c2df29917fc941cf75f1e64/1?pq-origsite=gscholar&cbl=276284,0,10.2478/s11772-011-0025-3
20,"J Rout, S Das, M Mishra",An Empirical Analysis of Digital Image Color Quantization using Partition Based Clustering Techniques,1,2022, ieeexplore.ieee.org, 2022 IEEE 2nd International …,https://ieeexplore.ieee.org/abstract/document/10051562/,0,10.1109/isssc56467.2022.10051562
87,"T Pattnaik, P Kanungo",Dominant peak-means clustering for color image segmentation,1,2017, ieeexplore.ieee.org, 2017 International Conference on …,https://ieeexplore.ieee.org/abstract/document/8321889/,0,10.1109/i2c2.2017.8321889
67,"F Abedi, AF Al-Baghdadi",Multi-objective optimization for vector quantization via genetic algorithm,1,2024, opg.optica.org, Optics Continuum,https://opg.optica.org/abstract.cfm?uri=optcon-3-5-808,0,10.1364/optcon.517311
