Rank,Author,Title,Citations,Year,Publisher,Venue,Source,cit/year,DOI
5,"HD Cheng, XH Jiang, Y Sun, J Wang",Color image segmentation: advances and prospects,2710,2001, Elsevier, Pattern recognition,https://www.sciencedirect.com/science/article/pii/S0031320300001497,108,10.1016/s0031-3203(00)00149-7
27,"Y Liu, D Zhang, G Lu, WY Ma",A survey of content-based image retrieval with high-level semantics,2399,2007, Elsevier, Pattern recognition,https://www.sciencedirect.com/science/article/pii/S0031320306002184,126,10.1016/j.patcog.2006.04.045
69,"L Rokach, O Maimon",Clustering methods,2224,2005, Springer, Data mining and knowledge discovery handbook,https://link.springer.com/chapter/10.1007/0-387-25465-x_15,106,10.1007/978-3-642-93155-0_7
52,"S Krinidis, V Chatzis",A robust fuzzy local information C-means clustering algorithm,1353,2010, ieeexplore.ieee.org, IEEE transactions on image processing,https://ieeexplore.ieee.org/abstract/document/5393030/,85,10.1109/tip.2010.2040763
34,"V Singh, AK Misra",Detection of plant leaf diseases using image segmentation and soft computing techniques,1350,2017, Elsevier, Information processing in Agriculture,https://www.sciencedirect.com/science/article/pii/S2214317316300154,150,10.1016/j.inpa.2016.10.005
83,"SM Lucas, A Panaretos, L Sosa, A Tang…","ICDAR 2003 robust reading competitions: entries, results, and future directions",1209,2005, Springer, International Journal of …,https://link.springer.com/article/10.1007/s10032-004-0134-3,58,10.1007/s10032-004-0134-3
100,"X Ji, JF Henriques, A Vedaldi",Invariant information clustering for unsupervised image classification and segmentation,1071,2019, openaccess.thecvf.com, Proceedings of the IEEE …,http://openaccess.thecvf.com/content_ICCV_2019/html/Ji_Invariant_Information_Clustering_for_Unsupervised_Image_Classification_and_Segmentation_ICCV_2019_paper.html,153,10.1109/iccv.2019.00996
12,"S Katz, A Tal",Hierarchical mesh decomposition using fuzzy clustering and cuts,954,2003, dl.acm.org, ACM transactions on graphics (TOG),https://dl.acm.org/doi/abs/10.1145/882262.882369,41,10.1145/882262.882369
78,"I Zehavi, Z Zheng, DH Weinberg…",Galaxy clustering in the completed SDSS redshift survey: the dependence on color and luminosity,946,2011, iopscience.iop.org, The Astrophysical …,https://iopscience.iop.org/article/10.1088/0004-637X/736/1/59/meta,63,10.1088/0004-637x/736/1/59
94,"ER Hruschka, RJGB Campello…",A survey of evolutionary algorithms for clustering,932,2009, ieeexplore.ieee.org, IEEE Transactions on …,https://ieeexplore.ieee.org/abstract/document/4783080/,55,10.1109/tsmcc.2008.2007252
18,"S Gieseke, C Röhr, A Siódmok",Colour reconnections in Herwig++,930,2012, Springer, The European Physical Journal C,https://link.springer.com/article/10.1140/epjc/s10052-012-2225-5,66,10.1140/epjc/s10052-012-2225-5
72,"N Senthilkumaran, R Rajesh",Image segmentation-a survey of soft computing approaches,815,2009, ieeexplore.ieee.org, 2009 International Conference …,https://ieeexplore.ieee.org/abstract/document/5328277/,48,10.1109/artcom.2009.219
74,"SEF De Avila, APB Lopes, A da Luz Jr…",VSUMM: A mechanism designed to produce static video summaries and a novel evaluation method,795,2011, Elsevier, Pattern recognition …,https://www.sciencedirect.com/science/article/pii/S0167865510002783,53,10.1016/j.patrec.2010.08.004
70,JG Arnal Barbedo,"Digital image processing techniques for detecting, quantifying and classifying plant diseases",751,2013, Springer, SpringerPlus,https://link.springer.com/article/10.1186/2193-1801-2-660,58,10.1016/j.matpr.2021.06.271
43,"H Li, O Chutatape",Automated feature extraction in color retinal images by a model based approach,750,2004, ieeexplore.ieee.org, IEEE Transactions on biomedical …,https://ieeexplore.ieee.org/abstract/document/1262102/,34,10.1109/tbme.2003.820400
64,"B Zheng, SW Yoon, SS Lam",Breast cancer diagnosis based on feature extraction using a hybrid of K-means and support vector machine algorithms,726,2014, Elsevier, Expert Systems with Applications,https://www.sciencedirect.com/science/article/pii/S0957417413006659,60,10.1016/j.eswa.2013.08.044
66,"S Arivazhagan, RN Shebiah, S Ananthi…",Detection of unhealthy region of plant leaves and classification of plant leaf diseases using texture features,700,2013, cigrjournal.org, Agricultural …,http://cigrjournal.org/index.php/Ejounral/article/view/2338,54,10.1049/iet-cvi.2018.5028
85,"NM Zaitoun, MJ Aqel",Survey on image segmentation techniques,692,2015, Elsevier, Procedia Computer Science,https://www.sciencedirect.com/science/article/pii/S1877050915028574,63,10.1007/978-981-13-0761-4_105
99,"E Dimitriadou, K Hornik, F Leisch, D Meyer…","Misc functions of the Department of Statistics (e1071), TU Wien",685,2008, Citeseer, R package,https://citeseerx.ist.psu.edu/document?repid=rep1&type=pdf&doi=3ceff42db79be884fc7b18b22fcc6ba0d8ef0faf,38,10.32614/cran.package.e1071
7,"L Fu, E Medico","FLAME, a novel fuzzy clustering method for the analysis of DNA microarray data",670,2007, Springer, BMC bioinformatics,https://link.springer.com/article/10.1186/1471-2105-8-3,35,10.1186/1471-2105-8-3
60,"E Hamuda, M Glavin, E Jones",A survey of image processing techniques for plant extraction and segmentation in the field,670,2016, Elsevier, Computers and electronics in agriculture,https://www.sciencedirect.com/science/article/pii/S0168169916301557,67,10.1016/j.compag.2016.04.024
4,"L Lucchese, SK Mitra",Colour image segmentation: a state-of-the-art survey,649,2001, ultra.sdk.free.fr,Indian National Science Academy Part A,http://ultra.sdk.free.fr/docs/Image-Processing/filters/Color%20Image%20Segmentation-A%20State-of-the-Art%20Survey.pdf,26,10.1109/icacc.2009.78
39,"SA Chatzichristofis, YS Boutalis",CEDD: Color and edge directivity descriptor: A compact descriptor for image indexing and retrieval,644,2008, Springer, …   ICVS 2008 Santorini  Greece  May 12 …,https://link.springer.com/chapter/10.1007/978-3-540-79547-6_30,36,10.1007/978-3-540-79547-6_30
24,"JV De Oliveira, W Pedrycz",Advances in fuzzy clustering and its applications,643,2007, books.google.com,,https://books.google.com/books?hl=en&lr=&id=Pn0e1xm4YBgC&oi=fnd&pg=PR5&dq=Soft+clustering+for+dominant+color+extraction&ots=jHuN5In9UG&sig=T2Pzo50Z6I1Z_OPKdlKngts3CQU,34,10.1002/9780470061190
98,"AP Gasch, MB Eisen",Exploring the conditional coregulation of yeast gene expression through fuzzy k-means clustering,615,2002, Springer, Genome biology,https://link.springer.com/article/10.1186/gb-2002-3-11-research0059,26,10.1186/gb-2002-3-11-research0059
88,"Y Chen, JZ Wang",A region-based fuzzy feature matching approach to content-based image retrieval,592,2002, ieeexplore.ieee.org, IEEE transactions on pattern analysis and …,https://ieeexplore.ieee.org/abstract/document/1033216/,25,10.1109/tpami.2002.1033216
95,"MGH Omran, AP Engelbrecht…",An overview of clustering methods,566,2007, content.iospress.com, Intelligent Data …,https://content.iospress.com/articles/intelligent-data-analysis/ida00305,30,10.9790/3021-0204719725
58,"A Levin, A Rav-Acha…",Spectral matting,554,2008, ieeexplore.ieee.org, IEEE transactions on …,https://ieeexplore.ieee.org/abstract/document/4547428/,31,10.1109/tpami.2008.168
75,"E Abdel-Maksoud, M Elmogy, R Al-Awadi",Brain tumor segmentation based on a hybrid clustering technique,536,2015, Elsevier, Egyptian Informatics Journal,https://www.sciencedirect.com/science/article/pii/S1110866515000043,49,10.1016/j.eij.2015.01.003
33,"X Li, K Wang, Y Lyu, H Pan, J Zhang…",Deep learning enables accurate clustering with batch effect removal in single-cell RNA-seq analysis,534,2020, nature.com, Nature …,https://www.nature.com/articles/s41467-020-15851-3,89,10.1101/530378
25,"S Antani, R Kasturi, R Jain","A survey on the use of pattern recognition methods for abstraction, indexing and retrieval of images and video",527,2002, Elsevier, Pattern recognition,https://www.sciencedirect.com/science/article/pii/S0031320301000863,22,10.1016/s0031-3203(01)00086-3
35,"J Han, KK Ma",Fuzzy color histogram and its use in color image retrieval,480,2002, ieeexplore.ieee.org, IEEE Transactions on image Processing,https://ieeexplore.ieee.org/abstract/document/1025168/,20,10.1109/tip.2002.801585
10,"M Guijarro, G Pajares, I Riomoros, PJ Herrera…",Automatic segmentation of relevant textures in agricultural images,468,2011, Elsevier, … and Electronics in …,https://www.sciencedirect.com/science/article/pii/S0168169910001924,31,10.1016/j.compag.2010.09.013
29,"SA Chatzichristofis, YS Boutalis",Fcth: Fuzzy color and texture histogram-a low level feature for accurate image retrieval,418,2008, ieeexplore.ieee.org, 2008 ninth international …,https://ieeexplore.ieee.org/abstract/document/4556917/,23,10.1109/wiamis.2008.24
87,"Z Ren, S Gao, LT Chia…",Region-based saliency detection and its application in object recognition,417,2013, ieeexplore.ieee.org, IEEE Transactions on …,https://ieeexplore.ieee.org/abstract/document/6587754/,32,10.1109/tcsvt.2013.2280096
13,"A Ghosh, NS Mishra, S Ghosh",Fuzzy clustering algorithms for unsupervised change detection in remote sensing images,412,2011, Elsevier, Information Sciences,https://www.sciencedirect.com/science/article/pii/S0020025510005153,27,10.1016/j.ins.2010.10.016
15,"X Liming, Z Yanchao",Automated strawberry grading system based on image processing,403,2010, Elsevier, Computers and electronics in agriculture,https://www.sciencedirect.com/science/article/pii/S016816990900204X,25,10.1016/j.compag.2009.09.013
53,"WX Kang, QQ Yang, RP Liang",The comparative research on image segmentation algorithms,392,2009, ieeexplore.ieee.org, 2009 First international …,https://ieeexplore.ieee.org/abstract/document/4959132/,23,10.1109/etcs.2009.417
54,"E Stergiopoulou, N Papamarkos",Hand gesture recognition using a neural network shape fitting technique,383,2009, Elsevier, Engineering Applications of Artificial …,https://www.sciencedirect.com/science/article/pii/S0952197609000694,23,10.1016/j.engappai.2009.03.008
82,"R da Silva Torres, AX Falcao",Content-based image retrieval: theory and applications.,378,2006, academia.edu, RITA,https://www.academia.edu/download/54642042/download.pdf,19,10.1117/12.660260
56,"A Latif, A Rasheed, U Sajid, J Ahmed…",Content‐Based Image Retrieval and Feature Extraction: A Comprehensive Review,372,2019, Wiley Online Library, Mathematical …,https://onlinelibrary.wiley.com/doi/abs/10.1155/2019/9658350,53,10.1155/2019/9658350
2,P Schmid,Segmentation of digitized dermatoscopic images by two-dimensional color clustering,371,2002, ieeexplore.ieee.org, IEEE Transactions on Medical Imaging,https://ieeexplore.ieee.org/abstract/document/759124/,15,10.1109/42.759124
36,"KS Tan, NAM Isa",Color image segmentation using histogram thresholding–Fuzzy C-means hybrid approach,370,2011, Elsevier, Pattern recognition,https://www.sciencedirect.com/science/article/pii/S0031320310003523,25,10.1016/j.patcog.2010.07.013
97,A Osareh,Automated identification of diabetic retinal exudates in digital color images,364,2018, api.taylorfrancis.com, Color Image Processing,https://api.taylorfrancis.com/content/chapters/edit/download?identifierName=doi&identifierValue=10.1201/9781315221526-22&type=chapterpdf,46,10.1201/9781315221526-22
46,"A Sopharak, B Uyyanonvara, S Barman",Automatic exudate detection from non-dilated diabetic retinopathy retinal images using fuzzy c-means clustering,364,2009, mdpi.com, sensors,https://www.mdpi.com/1424-8220/9/3/2148,21,10.3390/s90302148
9,"XY Wang, YJ Yu, HY Yang","An effective image retrieval scheme using color, texture and shape features",360,2011, Elsevier, Computer Standards & Interfaces,https://www.sciencedirect.com/science/article/pii/S0920548910000322,24,10.1016/j.csi.2010.03.004
3,"T Lei, X Jia, Y Zhang, S Liu, H Meng…",Superpixel-based fast fuzzy C-means clustering for color image segmentation,354,2018, ieeexplore.ieee.org, … Transactions on Fuzzy …,https://ieeexplore.ieee.org/abstract/document/8584141/,44,10.1109/tfuzz.2018.2889018
63,"E Aljalbout, V Golkov, Y Siddiqui, M Strobel…",Clustering with deep learning: Taxonomy and new methods,351,2018, arxiv.org, arXiv preprint arXiv …,https://arxiv.org/abs/1801.07648,44,10.1063/5.0175632
1,"G Dong, M Xie",Color clustering and learning for image segmentation based on neural networks,339,2005, ieeexplore.ieee.org, IEEE transactions on neural networks,https://ieeexplore.ieee.org/abstract/document/1461434/,16,10.1109/tnn.2005.849822
68,"A Osareh, B Shadgar…",A computational-intelligence-based approach for detection of exudates in diabetic retinopathy images,336,2009, ieeexplore.ieee.org, IEEE Transactions on …,https://ieeexplore.ieee.org/abstract/document/5156192/,20,10.1109/titb.2008.2007493
31,"A Dantcheva, C Velardo, A D'angelo…",Bag of soft biometrics for person identification: New trends and challenges,336,2011, Springer, Multimedia Tools and …,https://link.springer.com/article/10.1007/s11042-010-0635-7,22,10.1109/icsipa.2015.7412149
91,"P Schmid-Saugeona, J Guillodb, JP Thirana",Towards a computer-aided diagnosis system for pigmented skin lesions,328,2003, Elsevier, … Medical Imaging and …,https://www.sciencedirect.com/science/article/pii/S0895611102000484,14,10.1016/s0895-6111(02)00048-4
6,"S Naz, H Majeed, H Irshad",Image segmentation using fuzzy clustering: A survey,313,2010, ieeexplore.ieee.org, 2010 6th international conference …,https://ieeexplore.ieee.org/abstract/document/5638492/,20,10.1109/icet.2010.5638492
26,"Y Jiang, FL Chung, S Wang, Z Deng…",Collaborative fuzzy clustering from multiple weighted views,309,2014, ieeexplore.ieee.org, IEEE transactions on …,https://ieeexplore.ieee.org/abstract/document/6862861/,26,10.1109/tcyb.2014.2334595
21,"S Zhang, H Wang, W Huang, Z You","Plant diseased leaf segmentation and recognition by fusion of superpixel, K-means and PHOG",309,2018, Elsevier, Optik,https://www.sciencedirect.com/science/article/pii/S0030402617316108,39,10.1016/j.ijleo.2017.11.190
48,"J Selvakumar, A Lakshmi…",Brain tumor segmentation and its area calculation in brain MR images using K-mean clustering and Fuzzy C-mean algorithm,308,2012, ieeexplore.ieee.org, … international conference on …,https://ieeexplore.ieee.org/abstract/document/6215996/,22,10.1007/978-981-15-2696-1_83
73,"J Li, S Ray, BG Lindsay",A nonparametric statistical approach to clustering via mode identification,308,2007, jmlr.org, Journal of Machine Learning Research,http://www.jmlr.org/papers/volume8/li07a/li07a.pdf,16,10.1080/03610919708813380
20,"A Meunkaewjinda, P Kumsawat…",Grape leaf disease detection from color imagery using hybrid intelligent system,305,2008, ieeexplore.ieee.org, 2008 5th …,https://ieeexplore.ieee.org/abstract/document/4600483/,17,10.1109/ecticon.2008.4600483
51,"M Singha, K Hemachandran",Content based image retrieval using color and texture,301,2012, academia.edu, Signal & Image Processing,https://www.academia.edu/download/43981756/ccm.pdf,22,10.14445/22312803/ijctt-v48p117
47,"L Zdeborová, F Krząkała",Phase transitions in the coloring of random graphs,300,2007, APS, Physical Review E—Statistical  Nonlinear  and Soft …,https://journals.aps.org/pre/abstract/10.1103/PhysRevE.76.031131,16,10.1103/physreve.76.031131
96,"Y Lei, Z He, Y Zi, X Chen",New clustering algorithm-based fault diagnosis using compensation distance evaluation technique,296,2008, Elsevier, Mechanical Systems and Signal Processing,https://www.sciencedirect.com/science/article/pii/S0888327007001227,16,10.1016/j.ymssp.2007.07.013
30,"DE Ilea, PF Whelan",Image segmentation based on the integration of colour–texture descriptors—A review,295,2011, Elsevier, Pattern Recognition,https://www.sciencedirect.com/science/article/pii/S0031320311000902,20,10.1016/j.patcog.2011.03.005
76,"J Xu, O Chutatape, E Sung, C Zheng, PCT Kuan",Optic disk feature extraction via modified deformable model technique for glaucoma analysis,291,2007, Elsevier, Pattern recognition,https://www.sciencedirect.com/science/article/pii/S0031320306004158,15,10.1016/j.patcog.2006.10.015
61,W Khan,Image segmentation techniques: A survey,288,2013, academia.edu, Journal of image and graphics,https://www.academia.edu/download/38482575/20131226051740869.pdf,22,10.1007/978-981-13-0761-4_105
92,"DA Vaquero, RS Feris, D Tran, L Brown…",Attribute-based people search in surveillance environments,285,2009, ieeexplore.ieee.org, 2009 workshop on …,https://ieeexplore.ieee.org/abstract/document/5403131/,17,10.1109/wacv.2009.5403131
45,"KR Gavhale, U Gawande",An overview of the research on plant leaves disease detection using image processing techniques,285,2014, researchgate.net, Iosr journal of computer engineering …,https://www.researchgate.net/profile/Ujwalla-Gawande/publication/314436486_An_Overview_of_the_Research_on_Plant_Leaves_Disease_detection_using_Image_Processing_Techniques/links/5d3710664585153e591a3d20/An-Overview-of-the-Research-on-Plant-Leaves-Disease-detection-using-Image-Processing-Techniques.pdf,24,10.9790/0661-16151016
86,"WS Chu, Y Song, A Jaimes",Video co-summarization: Video summarization by visual co-occurrence,283,2015, openaccess.thecvf.com, Proceedings of the IEEE …,http://openaccess.thecvf.com/content_cvpr_2015/html/Chu_Video_Co-Summarization_Video_2015_CVPR_paper.html,26,10.1109/cvpr.2015.7298981
90,"G Dhingra, V Kumar, HD Joshi",Study of digital image processing techniques for leaf disease detection and classification,282,2018, Springer, Multimedia Tools and Applications,https://link.springer.com/article/10.1007/s11042-017-5445-8,35,10.1007/s11042-017-5445-8
32,"PR Kersten, JS Lee…",Unsupervised classification of polarimetric synthetic aperture radar images using fuzzy clustering and EM clustering,282,2005, ieeexplore.ieee.org, IEEE Transactions on …,https://ieeexplore.ieee.org/abstract/document/1396324/,13,10.1109/tgrs.2004.842108
65,"MM Rahman, P Bhattacharya…",A framework for medical image retrieval using machine learning and statistical similarity matching techniques with relevance feedback,281,2007, ieeexplore.ieee.org, IEEE transactions on …,https://ieeexplore.ieee.org/abstract/document/4049802/,15,10.1109/titb.2006.884364
23,"A Mojsilovic, J Kovacevic, J Hu…",Matching and retrieval based on the vocabulary and grammar of color patterns,278,2000, ieeexplore.ieee.org, IEEE transactions on …,https://ieeexplore.ieee.org/abstract/document/817597/,11,10.1109/83.817597
80,"H Kong, M Gurcan…",Partitioning histopathological images: an integrated framework for supervised color-texture segmentation and cell splitting,268,2011, ieeexplore.ieee.org, IEEE transactions on …,https://ieeexplore.ieee.org/abstract/document/5746646/,18,10.1109/tmi.2011.2141674
22,"W Dong, N Zhou, JC Paul, X Zhang",Optimized image resizing using seam carving and scaling,267,2009, dl.acm.org, ACM Transactions on Graphics …,https://dl.acm.org/doi/abs/10.1145/1618452.1618471,16,10.1145/1661412.1618471
84,"W William, A Ware, AH Basaza-Ejiri…",A review of image analysis and machine learning techniques for automated cervical cancer screening from pap-smear images,266,2018, Elsevier, Computer methods and …,https://www.sciencedirect.com/science/article/pii/S0169260717307459,33,10.1016/j.cmpb.2018.05.034
79,"J Hou, H Gao, X Li",DSets-DBSCAN: A parameter-free clustering algorithm,265,2016, ieeexplore.ieee.org, IEEE Transactions on Image Processing,https://ieeexplore.ieee.org/abstract/document/7460951/,26,10.1109/tip.2016.2559803
41,"S Dasiopoulou, V Mezaris…",Knowledge-assisted semantic video object detection,263,2005, ieeexplore.ieee.org, … on Circuits and …,https://ieeexplore.ieee.org/abstract/document/1512239/,13,10.1109/tcsvt.2005.854238
19,"JM Biosca, JL Lerma",Unsupervised robust planar segmentation of terrestrial laser scanner point clouds based on fuzzy clustering methods,261,2008, Elsevier, ISPRS Journal of Photogrammetry and Remote …,https://www.sciencedirect.com/science/article/pii/S0924271607000809,14,10.1016/j.isprsjprs.2007.07.010
40,"L Cinque, G Ciocca, S Levialdi, A Pellicano…",Color-based image retrieval using spatial-chromatic histograms,260,2001, Elsevier, Image and Vision …,https://www.sciencedirect.com/science/article/pii/S0262885601000609,10,10.1109/mmcs.1999.778621
59,"OAB Penatti, E Valle, RS Torres",Comparative study of global color and texture descriptors for web image retrieval,258,2012, Elsevier, Journal of visual communication and …,https://www.sciencedirect.com/science/article/pii/S1047320311001465,18,10.1016/j.jvcir.2011.11.002
16,"DJ Bora, AK Gupta, FA Khan",Comparing the performance of L* A* B* and HSV color spaces with respect to color image segmentation,251,2015, arxiv.org, arXiv preprint arXiv:1506.01472,https://arxiv.org/abs/1506.01472,23,10.22232/stj.2019.07.01.05
44,"YM Tikunov, S Laptenok, RD Hall, A Bovy…",MSClust: a tool for unsupervised mass spectra extraction of chromatography-mass spectrometry ion-wise aligned data,245,2012, Springer, Metabolomics,https://link.springer.com/article/10.1007/s11306-011-0368-2,18,10.1007/s11306-011-0368-2
81,"A Ghosal, A Nandy, AK Das, S Goswami…",A short review on different clustering techniques and their applications,180,2020, Springer, Emerging Technology in …,https://link.springer.com/chapter/10.1007/978-981-13-7403-6_9,30,10.1007/978-981-13-7403-6_9
57,"H Greenspan, J Goldberger, I Eshet",Mixture model for face-color modeling and segmentation,178,2001, Elsevier, Pattern Recognition Letters,https://www.sciencedirect.com/science/article/pii/S0167865501000861,7,10.1016/s0167-8655(01)00086-1
38,"SR Vantaram, E Saber",Survey of contemporary trends in color image segmentation,176,2012, spiedigitallibrary.org, Journal of Electronic Imaging,https://www.spiedigitallibrary.org/journals/journal-of-electronic-imaging/volume-21/issue-4/040901/Survey-of-contemporary-trends-in-color-image-segmentation/10.1117/1.JEI.21.4.040901.short,13,10.1117/1.jei.21.4.040901
71,"H Mittal, AC Pandey, M Saraswat, S Kumar…","A comprehensive survey of image segmentation: clustering methods, performance parameters, and benchmark datasets",174,2022, Springer, Multimedia Tools and …,https://link.springer.com/article/10.1007/s11042-021-10594-9,44,10.1007/s11042-021-10594-9
8,"SH Leung, SL Wang, WH Lau",Lip image segmentation using fuzzy clustering incorporating an elliptic shape function,174,2004, ieeexplore.ieee.org, IEEE transactions on image …,https://ieeexplore.ieee.org/abstract/document/1262013/,8,10.1109/tip.2003.818116
17,"J Fan, M Han, J Wang",Single point iterative weighted fuzzy C-means clustering algorithm for remote sensing image segmentation,170,2009, Elsevier, Pattern Recognition,https://www.sciencedirect.com/science/article/pii/S0031320309001563,10,10.1016/j.patcog.2009.04.013
50,"S Das, S Sil",Kernel-induced fuzzy clustering of image pixels with an improved differential evolution algorithm,170,2010, Elsevier, Information Sciences,https://www.sciencedirect.com/science/article/pii/S0020025509005192,11,10.1016/j.ins.2009.11.041
55,"B Balasko, J Abonyi, B Feil",Fuzzy clustering and data analysis toolbox,169,2005, academia.edu, Department of Process Engineering …,https://www.academia.edu/download/34400988/fuzzyclusteringtoolbox.pdf,8,10.1243/09544119jeim384
49,"IK Sethi, IL Coman, D Stan",Mining association rules between low-level image features and high-level concepts,168,2001, spiedigitallibrary.org, Data mining and knowledge …,https://www.spiedigitallibrary.org/conference-proceedings-of-spie/4384/0000/Mining-association-rules-between-low-level-image-features-and-high/10.1117/12.421083.short,7,10.1117/12.421083
11,"CC Hung, S Kulkarni, BC Kuo",A new weighted fuzzy c-means clustering algorithm for remotely sensed image classification,167,2010, ieeexplore.ieee.org, IEEE Journal of selected topics …,https://ieeexplore.ieee.org/abstract/document/5658101/,10,10.1109/jstsp.2010.2096797
37,"T Lei, P Liu, X Jia, X Zhang, H Meng…",Automatic fuzzy clustering framework for image segmentation,163,2019, ieeexplore.ieee.org, … Transactions on Fuzzy …,https://ieeexplore.ieee.org/abstract/document/8770118/,23,10.1109/tfuzz.2019.2930030
62,"MHF Zarandi, M Zarinbal, M Izadi",Systematic image processing for diagnosing brain tumors: A Type-II fuzzy expert system approach,162,2011, Elsevier, Applied soft computing,https://www.sciencedirect.com/science/article/pii/S1568494609002324,11,10.1016/j.asoc.2009.11.019
77,"L Kapoor, S Thakur",A survey on brain tumor detection using image processing techniques,161,2017, ieeexplore.ieee.org, … on cloud computing  data science & …,https://ieeexplore.ieee.org/abstract/document/7943218/,18,10.1109/confluence.2017.7943218
93,"KB Vaishnavee, K Amshakala",An automated MRI brain image segmentation and tumor detection using SOM-clustering and Proximal Support Vector Machine classifier,97,2015, ieeexplore.ieee.org, 2015 IEEE international …,https://ieeexplore.ieee.org/abstract/document/7275030/,9,10.1109/icetech.2015.7275030
67,"X Qi, J Dong, Y Lan, H Zhu",Method for identifying litchi picking position based on YOLOv5 and PSPNet,47,2022, mdpi.com, Remote Sensing,https://www.mdpi.com/2072-4292/14/9/2004,12,10.3390/rs14092004
14,"Q Li-Ying, W Ke-Gang",Kernel fuzzy clustering based classification of ancient-ceramic fragments,28,2010, ieeexplore.ieee.org, 2010 2nd IEEE International …,https://ieeexplore.ieee.org/abstract/document/5477818/,2,10.1109/icime.2010.5477818
28,"S Alférez, A Merino, A Acevedo, L Puigví…",Color clustering segmentation framework for image analysis of malignant lymphoid cells in peripheral blood,28,2019, Springer, Medical & biological …,https://link.springer.com/article/10.1007/s11517-019-01954-7,4,10.1007/s11517-019-01954-7
